date,question,committee,project_id,responsible_actor,invited_presenters
2025-05-28,Posėdžio darbotvarkės tvirtinimas,Europos reikalų komitetas,,R.  BudbergytėD.  Asevičienė,
2025-05-28,"Ministro ataskaita apie  Europos Sąjungos Bendrųjų reikalų tarybos posėdį, vykusį 2025 m. balandžio 27 d. (",Europos reikalų komitetas,,R.  BaranovasA.  LydekaM.  Lukoševičius,
2025-05-28,Kviečiami dalyvauti:,Europos reikalų komitetas,,R.  BaranovasA.  LydekaM.  Lukoševičius,
2025-05-28,Užsienio reikalų ministras Kęstutis Budrys,Europos reikalų komitetas,,R.  BaranovasA.  LydekaM.  Lukoševičius,
2025-05-28,"Lietuvos Respublikos pozicijų pristatymas prieš vykstant į Europos Sąjungos Transporto, telekomunikacijų, energetikos tarybos 2025 m. birželio 5–6 d. posėdį (transporto, telekomunikacijų kl.)  (",Europos reikalų komitetas,,R.  ŠukysD.  KreivysE.  Kolelė,
2025-05-28,Kviečiami dalyvauti:,Europos reikalų komitetas,,R.  ŠukysD.  KreivysE.  Kolelė,
2025-05-28,Susisiekimo ministras Eugenijus Sabutis,Europos reikalų komitetas,,R.  ŠukysD.  KreivysE.  Kolelė,
2025-05-28,Ekonomikos ir inovacijų ministerijos atstovai,Europos reikalų komitetas,,R.  ŠukysD.  KreivysE.  Kolelė,
2025-05-28,Krašto apsaugos ministerijos atstovai​,Europos reikalų komitetas,,R.  ŠukysD.  KreivysE.  Kolelė,
2025-05-28,"Ministro ataskaita apie Europos Sąjungos Konkurencingumo tarybos posėdį,  vykusį 2025 m. gegužės 22–23 d. (vidaus rinkos, pramonės, mokslinių tyrimų ir kosmoso klausimai)  (",Europos reikalų komitetas,,L.  BalsysR.  Morkūnaitė-MikulėnienėD.  Paužaitė-Šliachtovič,
2025-05-28,Kviečiami dalyvauti:,Europos reikalų komitetas,,L.  BalsysR.  Morkūnaitė-MikulėnienėD.  Paužaitė-Šliachtovič,
2025-05-28,Ekonomikos ir inovacijų ministras Lukas Savickas,Europos reikalų komitetas,,L.  BalsysR.  Morkūnaitė-MikulėnienėD.  Paužaitė-Šliachtovič,
2025-05-28,"Švietimo, mokslo ir sporto ministrė Raminta Popovienė ​",Europos reikalų komitetas,,L.  BalsysR.  Morkūnaitė-MikulėnienėD.  Paužaitė-Šliachtovič,
2025-05-28,"Ministro ataskaita apie Europos Sąjungos Žemės ūkio ir žuvininkystės tarybos posėdį, vykusį 2025 m. gegužės 26 d.  (",Europos reikalų komitetas,,T.  TomilinasK.  StarkevičiusD.  Paužaitė-Šliachtovič,
2025-05-28,Kviečiami dalyvauti:,Europos reikalų komitetas,,T.  TomilinasK.  StarkevičiusD.  Paužaitė-Šliachtovič,
2025-05-28,Žemės ūkio ministras Ignas Hofmanas,Europos reikalų komitetas,,T.  TomilinasK.  StarkevičiusD.  Paužaitė-Šliachtovič,
2025-05-21,2021-2027 m. ES fondų investicijų programos įgyvendinimas,Europos reikalų komitetas,,L.  BalsysD.  KreivysA.  Pikiotienė,
2025-05-21,Kviečiami dalyvauti:,Europos reikalų komitetas,,L.  BalsysD.  KreivysA.  Pikiotienė,
2025-05-21,Finansų ministras Rimantas Šadžius,Europos reikalų komitetas,,L.  BalsysD.  KreivysA.  Pikiotienė,
2025-05-21,Lietuvos Respublikos pozicijų pristatymas prieš vykstant į Europos Sąjungos Žemės ūkio ir žuvininkystės tarybos 2025 m. gegužės 26 d. posėdį  (,Europos reikalų komitetas,,T.  TomilinasK.  StarkevičiusD.  Paužaitė-Šliachtovič,
2025-05-21,Kviečiami dalyvauti:,Europos reikalų komitetas,,T.  TomilinasK.  StarkevičiusD.  Paužaitė-Šliachtovič,
2025-05-21,Žemės ūkio ministras Ignas Hofmanas,Europos reikalų komitetas,,T.  TomilinasK.  StarkevičiusD.  Paužaitė-Šliachtovič,
2025-05-21,"Lietuvos Respublikos pozicijų pristatymas prieš vykstant į Europos Sąjungos Konkurencingumo tarybos 2025 m. gegužės 22–23 d. posėdį (vidaus rinkos, pramonės, mokslinių tyrimų ir kosmoso klausimai) (",Europos reikalų komitetas,,L.  BalsysR.  Morkūnaitė-MikulėnienėD.  Paužaitė-Šliachtovič,
2025-05-21,Kviečiami dalyvauti:,Europos reikalų komitetas,,L.  BalsysR.  Morkūnaitė-MikulėnienėD.  Paužaitė-Šliachtovič,
2025-05-21,Ekonomikos ir inovacijų ministras Lukas Savickas,Europos reikalų komitetas,,L.  BalsysR.  Morkūnaitė-MikulėnienėD.  Paužaitė-Šliachtovič,
2025-05-21,"Švietimo, mokslo ir sporto ministrė Raminta Popovienė ​",Europos reikalų komitetas,,L.  BalsysR.  Morkūnaitė-MikulėnienėD.  Paužaitė-Šliachtovič,
2025-05-21,Posėdžio darbotvarkės tvirtinimas,Europos reikalų komitetas,,R.  BudbergytėD.  Asevičienė,
2025-05-21,Lietuvos Respublikos pozicijų pristatymas prieš vykstant į  Europos Sąjungos Bendrųjų reikalų tarybos 2025 m. gegužės 27 d. posėdį (,Europos reikalų komitetas,,R.  MotuzasV.  Čmilytė-NielsenM.  Lukoševičius,
2025-05-21,Kviečiami dalyvauti:,Europos reikalų komitetas,,R.  MotuzasV.  Čmilytė-NielsenM.  Lukoševičius,
2025-05-21,Užsienio reikalų ministras Kęstutis Budrys,Europos reikalų komitetas,,R.  MotuzasV.  Čmilytė-NielsenM.  Lukoševičius,
2025-05-21,Būsima vidaus rinkos strategija ir ES konkurencingumo didinimas  (,Europos reikalų komitetas,,R.  BaranovasI.  ŠimonytėT.  TomilinasL.  BalsysJ.  ŠukevičienėV.  Čmilytė-NielsenR.  Morkūnaitė-MikulėnienėV.  ĄžuolasK.  NeimantasE.  ZingerisA.  AžubalisM.  Lukoševičius,
2025-05-21,Kviečiami dalyvauti:,Europos reikalų komitetas,,R.  BaranovasI.  ŠimonytėT.  TomilinasL.  BalsysJ.  ŠukevičienėV.  Čmilytė-NielsenR.  Morkūnaitė-MikulėnienėV.  ĄžuolasK.  NeimantasE.  ZingerisA.  AžubalisM.  Lukoševičius,
2025-05-21,Finansų viceministras Kristupas Vaitiekunas,Europos reikalų komitetas,,R.  BaranovasI.  ŠimonytėT.  TomilinasL.  BalsysJ.  ŠukevičienėV.  Čmilytė-NielsenR.  Morkūnaitė-MikulėnienėV.  ĄžuolasK.  NeimantasE.  ZingerisA.  AžubalisM.  Lukoševičius,
2025-05-21,Ekonomikos ir inovacijų viceministrė Agila Barzdienė​,Europos reikalų komitetas,,R.  BaranovasI.  ŠimonytėT.  TomilinasL.  BalsysJ.  ŠukevičienėV.  Čmilytė-NielsenR.  Morkūnaitė-MikulėnienėV.  ĄžuolasK.  NeimantasE.  ZingerisA.  AžubalisM.  Lukoševičius,
2025-05-14,Posėdžio darbotvarkės tvirtinimas,Europos reikalų komitetas,,R.  BudbergytėD.  Asevičienė,
2025-05-14,"Ministro ataskaita apie Europos Sąjungos Ekonomikos ir finansų reikalų tarybos Euro grupės posėdį, vykusį 2025 m. gegužės 13 d.  (",Europos reikalų komitetas,,L.  BalsysI.  ŠimonytėA.  Pikiotienė,
2025-05-14,Kviečiami dalyvauti:,Europos reikalų komitetas,,L.  BalsysI.  ŠimonytėA.  Pikiotienė,
2025-05-14,Finansų ministras Rimantas Šadžius,Europos reikalų komitetas,,L.  BalsysI.  ŠimonytėA.  Pikiotienė,
2025-05-14,"Ministro ataskaita apie į Europos Sąjungos Švietimo, jaunimo, kultūros ir sporto tarybos  posėdį, vykusį 2025 m. gegužės 12–13 d.  (",Europos reikalų komitetas,,V.  AleknavičienėR.  Morkūnaitė-MikulėnienėD.  Paužaitė-Šliachtovič,
2025-05-14,Kviečiami dalyvauti:,Europos reikalų komitetas,,V.  AleknavičienėR.  Morkūnaitė-MikulėnienėD.  Paužaitė-Šliachtovič,
2025-05-14,Kultūros ministras Šarūnas Birutis,Europos reikalų komitetas,,V.  AleknavičienėR.  Morkūnaitė-MikulėnienėD.  Paužaitė-Šliachtovič,
2025-05-14,"Švietimo, mokslo ir sporto ministrė Raminta Popovienė",Europos reikalų komitetas,,V.  AleknavičienėR.  Morkūnaitė-MikulėnienėD.  Paužaitė-Šliachtovič,
2025-05-14,Socialinės apsaugos ir darbo ministrė Inga Ruginienė​,Europos reikalų komitetas,,V.  AleknavičienėR.  Morkūnaitė-MikulėnienėD.  Paužaitė-Šliachtovič,
2025-05-14,Dėl Lietuvos kovos su dezinformacija ir manipuliacijomis plano (,Europos reikalų komitetas,,R.  BaranovasV.  Čmilytė-NielsenM.  Lukoševičius,
2025-05-14,Kviečiami dalyvauti:,Europos reikalų komitetas,,R.  BaranovasV.  Čmilytė-NielsenM.  Lukoševičius,
2025-05-14,Kultūros ministerijos viceministras Dr. Viktor Denisenko,Europos reikalų komitetas,,R.  BaranovasV.  Čmilytė-NielsenM.  Lukoševičius,
2025-05-14,Užsienio reikalų ministerijos viceministras Sigitas Mitkus,Europos reikalų komitetas,,R.  BaranovasV.  Čmilytė-NielsenM.  Lukoševičius,
2025-05-14,Krašto apsaugos ministerijos viceministras Karolis Aleksa,Europos reikalų komitetas,,R.  BaranovasV.  Čmilytė-NielsenM.  Lukoševičius,
2025-05-14,"Švietimo, mokslo ir sporto ministerijos viceministras Jonas Petkevičius",Europos reikalų komitetas,,R.  BaranovasV.  Čmilytė-NielsenM.  Lukoševičius,
2025-05-14,Nacionalinis krizių valdymo centras,Europos reikalų komitetas,,R.  BaranovasV.  Čmilytė-NielsenM.  Lukoševičius,
2025-05-14,Lietuvos Respublikos valstybės saugumo departamentas,Europos reikalų komitetas,,R.  BaranovasV.  Čmilytė-NielsenM.  Lukoševičius,
2025-05-14,Lietuvos radijo ir televizijos komisija,Europos reikalų komitetas,,R.  BaranovasV.  Čmilytė-NielsenM.  Lukoševičius,
2025-05-14,Žurnalistų etikos inspektoriaus tarnyba,Europos reikalų komitetas,,R.  BaranovasV.  Čmilytė-NielsenM.  Lukoševičius,
2025-05-14,Ryšių reguliavimo tarnyba​,Europos reikalų komitetas,,R.  BaranovasV.  Čmilytė-NielsenM.  Lukoševičius,
2025-05-14,2020 m. Seimo Europos reikalų ir Užsienio reikalų komitetų darbo grupės nuomonės „Dėl pasiūlymų dėl Europos Sąjungos ateities vertinimo ir Lietuvos Respublikos interesų“ apžvalga  (,Europos reikalų komitetas,,R.  BaranovasM.  Lukoševičius,
2025-05-14,ES ir vidaus saugumo ir gynybos politikos stiprinimas  (,Europos reikalų komitetas,,R.  BaranovasI.  ŠimonytėT.  TomilinasL.  BalsysJ.  ŠukevičienėV.  Čmilytė-NielsenR.  Morkūnaitė-MikulėnienėV.  ĄžuolasK.  NeimantasE.  ZingerisA.  AžubalisM.  Lukoševičius,
2025-05-14,Kviečiami dalyvauti:,Europos reikalų komitetas,,R.  BaranovasI.  ŠimonytėT.  TomilinasL.  BalsysJ.  ŠukevičienėV.  Čmilytė-NielsenR.  Morkūnaitė-MikulėnienėV.  ĄžuolasK.  NeimantasE.  ZingerisA.  AžubalisM.  Lukoševičius,
2025-05-14,Užsienio reikalų,Europos reikalų komitetas,,R.  BaranovasI.  ŠimonytėT.  TomilinasL.  BalsysJ.  ŠukevičienėV.  Čmilytė-NielsenR.  Morkūnaitė-MikulėnienėV.  ĄžuolasK.  NeimantasE.  ZingerisA.  AžubalisM.  Lukoševičius,
2025-05-14,viceministras S. Mitkus,Europos reikalų komitetas,,R.  BaranovasI.  ŠimonytėT.  TomilinasL.  BalsysJ.  ŠukevičienėV.  Čmilytė-NielsenR.  Morkūnaitė-MikulėnienėV.  ĄžuolasK.  NeimantasE.  ZingerisA.  AžubalisM.  Lukoševičius,
2025-05-14,Krašto apsaugos viceministras dr. K. Aleksa,Europos reikalų komitetas,,R.  BaranovasI.  ŠimonytėT.  TomilinasL.  BalsysJ.  ŠukevičienėV.  Čmilytė-NielsenR.  Morkūnaitė-MikulėnienėV.  ĄžuolasK.  NeimantasE.  ZingerisA.  AžubalisM.  Lukoševičius,
2025-05-14,Nacionalinio saugumo ir gynybos komiteto pirmininkas Giedrimas Jeglinskas​,Europos reikalų komitetas,,R.  BaranovasI.  ŠimonytėT.  TomilinasL.  BalsysJ.  ŠukevičienėV.  Čmilytė-NielsenR.  Morkūnaitė-MikulėnienėV.  ĄžuolasK.  NeimantasE.  ZingerisA.  AžubalisM.  Lukoševičius,
2025-05-07,Dėl Nacionalinio energetikos ir klimato srities (NEKS) veiksmų plano 2021-2030 m. įgyvendinimo eigos,Europos reikalų komitetas,,R.  ŠukysD.  KreivysE.  Kolelė,
2025-05-07,Kviečiami dalyvauti:,Europos reikalų komitetas,,R.  ŠukysD.  KreivysE.  Kolelė,
2025-05-07,Aplinkos ministras Povilas Poderskis,Europos reikalų komitetas,,R.  ŠukysD.  KreivysE.  Kolelė,
2025-05-07,Energetikos ministras Žygimantas Vaičiūnas,Europos reikalų komitetas,,R.  ŠukysD.  KreivysE.  Kolelė,
2025-05-07,Ekonomikos ir inovacijų ministerijos atstovai,Europos reikalų komitetas,,R.  ŠukysD.  KreivysE.  Kolelė,
2025-05-07,Susisiekimo ministerijos atstovai,Europos reikalų komitetas,,R.  ŠukysD.  KreivysE.  Kolelė,
2025-05-07,Žemės ūkio ministerijos atstovai,Europos reikalų komitetas,,R.  ŠukysD.  KreivysE.  Kolelė,
2025-05-07,Aplinkos apsaugos agentūros atstovai,Europos reikalų komitetas,,R.  ŠukysD.  KreivysE.  Kolelė,
2025-05-07,VšĮ Lietuvos energetikos agentūros atstovai​,Europos reikalų komitetas,,R.  ŠukysD.  KreivysE.  Kolelė,
2025-05-07,"Įstatymų projektų, perkeliančių ir (ar) įgyvendinančių Europos Sąjungos teisės aktų nuostatas, įgyvendinimo stebėsena",Europos reikalų komitetas,,R.  ŠukysA.  LydekaE.  Kolelė,
2025-05-07,Kviečiami dalyvauti:,Europos reikalų komitetas,,R.  ŠukysA.  LydekaE.  Kolelė,
2025-05-07,Teisingumo ministras Rimantas Mockus,Europos reikalų komitetas,,R.  ŠukysA.  LydekaE.  Kolelė,
2025-05-07,Lietuvos Respublikos Vyriausybės kanceliarijos atstovai​,Europos reikalų komitetas,,R.  ŠukysA.  LydekaE.  Kolelė,
