date,question,committee,project,responsible,attendees
2025-06-04,Posėdžio darbotvarkės tvirtinimas,Kaimo reikalų komitetas,,K.  MažeikaA.  Matulevičienė,
2025-06-04,Seimo nutarimo „Dėl Lietuvos Respublikos 2024 metų valstybės metinių ataskaitų rinkinio patvirtinimo“ projektas,Kaimo reikalų komitetas,XVP-453,K.  MažeikaD.  Černiavskienė,
2025-06-04,"​Finansų ministerijos, Valstybės kontrolės, Žemės ūkio ministerijos atstovai​​",Kaimo reikalų komitetas,XVP-453,K.  MažeikaD.  Černiavskienė,
2025-06-04,"Dėl įstatymo nuostatų, nustatančių maksimalius nuosavybės teise leidžiamus turėti žemės ūkio paskirties žemės plotus, tinkamo taikymo praktikoje užtikrinimo",Kaimo reikalų komitetas,,B.  RopėG.  Remeikienė,
2025-06-04,"​Aplinkos ministerijos, ​Žemės ūkio ministerijos, Nacionalinės žemės tarnybos prie AM,",Kaimo reikalų komitetas,,B.  RopėG.  Remeikienė,
2025-06-04,"Valstybės įmonės Žemės ūkio duomenų centras​, žemdirbių savivaldos organizacijų atstovai",Kaimo reikalų komitetas,,B.  RopėG.  Remeikienė,
2025-06-04,"Dėl papildomų reikalavimų, apsunkinančių žemės ūkio technikos registravimą",Kaimo reikalų komitetas,,K.  MažeikaG.  Rimeisienė,
2025-06-04,"​ ​Žemės ūkio ministerijos, Lietuvos transporto saugos administracijos, Valstybės įmonės Žemės ūkio duomenų centras​, Lietuvos savivaldybių asociacijos, Savivaldybių žemės ūkio skyrių darbuotojų asociacijos,​ žemdirbių savivaldos organizacijų atstovai​",Kaimo reikalų komitetas,,K.  MažeikaG.  Rimeisienė,
2025-06-04,Kiti klausimai,Kaimo reikalų komitetas,,K.  MažeikaA.  Matulevičienė,
2025-06-04,Ūkininko ūkio įstatymo Nr. VIII-1159 pakeitimo įstatymo projektas (nauja redakcija),Kaimo reikalų komitetas,VIII-1159,K.  MažeikaV.  PranckietisG.  Remeikienė,
2025-06-04,"​Žemės ūkio ministerijos, Socialinės apsaugos ir darbo ministerijos, Valstybinės darbo inspekcijos, Seimo kanceliarijos Teisės departamento,​ žemdirbių savivaldos organizacijų atstovai​",Kaimo reikalų komitetas,VIII-1159,K.  MažeikaV.  PranckietisG.  Remeikienė,
2025-05-28,Posėdžio darbotvarkės tvirtinimas,Kaimo reikalų komitetas,,K.  MažeikaA.  Matulevičienė,
2025-05-28,"Pasiūlymas EUROPOS PARLAMENTO IR TARYBOS REGLAMENTAS kuriuo dėl tam tikrų vyno sektoriaus ir aromatizuotų vyno produktų rinkos taisyklių ir paramos sektoriui priemonių iš dalies keičiami reglamentai (ES) Nr. 1308/2013, (ES) 2021/2115 ir (ES) Nr. 251/2014 (",Kaimo reikalų komitetas,1308/2013; 251/2014,K.  MažeikaD.  Černiavskienė,
2025-05-28,uždaras,Kaimo reikalų komitetas,1308/2013; 251/2014,K.  MažeikaD.  Černiavskienė,
2025-05-28,uždaras,Kaimo reikalų komitetas,1308/2013; 251/2014,K.  MažeikaD.  Černiavskienė,
2025-05-28,​Žemės ūkio ministerijos ir Valstybinės maisto ir veterinarijos tarnybos atstovai,Kaimo reikalų komitetas,1308/2013; 251/2014,K.  MažeikaD.  Černiavskienė,
2025-05-28,Saugumo įnašo įstatymo projektas,Kaimo reikalų komitetas,XVP-433,K.  MažeikaD.  Černiavskienė,
2025-05-28,"​​Finansų ministerijos, Žemės ūkio ministerijos, žemdirbių savivaldos organizacijų atstovai​​​",Kaimo reikalų komitetas,XVP-433,K.  MažeikaD.  Černiavskienė,
2025-05-28,"Gyventojų pajamų mokesčio įstatymo Nr. IX-1007 6, 13-1, 16, 17, 18, 18-2, 19, 20, 21, 23, 27, 34 ir 35 straipsnių pakeitimo įstatymo projektas",Kaimo reikalų komitetas,IX-1007,K.  MažeikaD.  Černiavskienė,
2025-05-28,"​​Finansų ministerijos, Žemės ūkio ministerijos, žemdirbių savivaldos organizacijų atstovai​​​",Kaimo reikalų komitetas,IX-1007,K.  MažeikaD.  Černiavskienė,
2025-05-28,Nekilnojamojo turto mokesčio įstatymo Nr. X-233 pakeitimo įstatymo projektas (nauja redakcija),Kaimo reikalų komitetas,X-233,K.  MažeikaD.  Černiavskienė,
2025-05-28,"Finansų ministerijos, Žemės ūkio ministerijos, žemdirbių savivaldos organizacijų atstovai​​​",Kaimo reikalų komitetas,X-233,K.  MažeikaD.  Černiavskienė,
2025-05-28,"Akcizų įstatymo Nr. IX-569 1, 2, 3 straipsnių pakeitimo ir II skyriaus papildymo devintuoju skirsniu įstatymo projektas",Kaimo reikalų komitetas,IX-569,K.  MažeikaD.  Černiavskienė,
2025-05-28,"Seimo narys Karolis Neimantas (pasiūlymo teikėjas)​​, Finansų ministerijos, Žemės ūkio ministerijos, žemdirbių savivaldos organizacijų atstovai​​​",Kaimo reikalų komitetas,IX-569,K.  MažeikaD.  Černiavskienė,
2025-05-28,Pridėtinės vertės mokesčio įstatymo Nr. IX-751 19 straipsnio pakeitimo įstatymo projektas,Kaimo reikalų komitetas,IX-751,K.  MažeikaD.  Černiavskienė,
2025-05-28,"Seimo narys Karolis Neimantas (pasiūlymo teikėjas)​​, Finansų ministerijos, Žemės ūkio ministerijos, žemdirbių savivaldos organizacijų atstovai​​​",Kaimo reikalų komitetas,IX-751,K.  MažeikaD.  Černiavskienė,
2025-05-28,Kiti klausimai,Kaimo reikalų komitetas,,K.  MažeikaA.  Matulevičienė,
2025-05-21,Posėdžio darbotvarkės tvirtinimas,Kaimo reikalų komitetas,,K.  MažeikaA.  Matulevičienė,
2025-05-21,"Melioracijos įstatymo Nr. I-323 1, 2, 7 ir 9 straipsnių pakeitimo ir Įstatymo papildymo VI skyriumi įstatymo projektas",Kaimo reikalų komitetas,I-323,T.  PrajaraK.  StarkevičiusG.  Rimeisienė,
2025-05-21,"​Seimo nariai Alvydas Mockus ir kt. (pasiūlymo teikėjas), Žemės ūkio, Aplinkos ministerijų, Lietuvos savivaldybių asociacijos, Savivaldybių žemės ūkio skyrių darbuotojų asociacijos, Lietuvos melioracijos įmonių asociacijos, Lietuvos žemėtvarkos ir hidrotechnikos inžinierių sąjungos atstovai",Kaimo reikalų komitetas,I-323,T.  PrajaraK.  StarkevičiusG.  Rimeisienė,
2025-05-21,Valstybės gynybos fondo įstatymo Nr. XIV-2775 4 straipsnio pakeitimo įstatymo projektas,Kaimo reikalų komitetas,XIV-2775,K.  MažeikaG.  Remeikienė,
2025-05-21,"​Seimo nariai Kazys Starkevičius ir Viktoras Fiodorovas (iniciatoriai),​ Aplinkos ministerijos, Nacionalinės žemės tarnybos prie Aplinkos ministerijos, ​Žemės ūkio ministerijos,​ žemdirbių savivaldos organizacijų atstovai​",Kaimo reikalų komitetas,XIV-2775,K.  MažeikaG.  Remeikienė,
2025-05-21,Žemės įstatymo Nr. I-446 11 ir 40 straipsnių pakeitimo įstatymo projektas,Kaimo reikalų komitetas,I-446,K.  MažeikaG.  Remeikienė,
2025-05-21,"​Seimo nariai Kazys Starkevičius ir Viktoras Fiodorovas (iniciatoriai),​ Aplinkos ministerijos, Nacionalinės žemės tarnybos prie Aplinkos ministerijos, Žemės ūkio ministerijos,​ ​žemdirbių savivaldos organizacijų atstovai​​",Kaimo reikalų komitetas,I-446,K.  MažeikaG.  Remeikienė,
2025-05-21,Žemės ūkio paskirties žemės įsigijimo įstatymo Nr. IX-1314 4 straipsnio pakeitimo įstatymo projektas,Kaimo reikalų komitetas,IX-1314,K.  MažeikaG.  Remeikienė,
2025-05-21,"​ Seimo nariai Kazys Starkevičius ir Viktoras Fiodorovas (iniciatoriai),​ Aplinkos ministerijos, Nacionalinės žemės tarnybos prie Aplinkos ministerijos, LR specialiųjų tyrimų tarnybos, Žemės ūkio ministerijos,​ žemdirbių savivaldos organizacijų atstovai​, Mindaugas Vilkickas​",Kaimo reikalų komitetas,IX-1314,K.  MažeikaG.  Remeikienė,
2025-05-21,Dėl pavasarinių šalnų padarinių,Kaimo reikalų komitetas,,K.  MažeikaD.  Černiavskienė,
2025-05-21,"Žemės ūkio ministerijos, Nacionalinės mokėjimo agentūros prie ŽŪM, Lietuvos savivaldybių asociacijos, žemdirbių savivaldos organizacijų atstovai​",Kaimo reikalų komitetas,,K.  MažeikaD.  Černiavskienė,
2025-05-21,Dėl veterinarinės medicinos gyvūnų augintinių sveikatos priežiūrai ir gerovei skirtų rezidentūros studijų vietų poreikio formavimo ir valstybinio finansavimo,Kaimo reikalų komitetas,,K.  MažeikaS.  Kairienė,
2025-05-21,"​​Lietuvos sveikatos mokslų universiteto, Aplinkos, Švietimo, mokslo ir sporto bei Žemės ūkio ministerijų atstovai​",Kaimo reikalų komitetas,,K.  MažeikaS.  Kairienė,
2025-05-21,Kiti klausimai,Kaimo reikalų komitetas,,K.  MažeikaA.  Matulevičienė,
2025-05-14,Posėdžio darbotvarkės tvirtinimas,Kaimo reikalų komitetas,,K.  MažeikaA.  Matulevičienė,
2025-05-14,Dėl valstybinės žemės ūkio paskirties ir miškų ūkio paskirties žemės pardavimo,Kaimo reikalų komitetas,,M.  SkamarakasG.  Remeikienė,
2025-05-14,"Nacionalinės žemės tarnybos prie Aplinkos ministerijos, Aplinkos ministerijos​, Žemės ūkio ministerijos, žemdirbių savivaldos organizacijų​ atstovai​​​",Kaimo reikalų komitetas,,M.  SkamarakasG.  Remeikienė,
2025-05-14,Dėl anglies kreditų rinkos situacijos Lietuvoje,Kaimo reikalų komitetas,,K.  MažeikaD.  Černiavskienė,
2025-05-14,"Žemės ūkio, Aplinkos ministerijų ir žemdirbių savivaldos organizacijų atstovai",Kaimo reikalų komitetas,,K.  MažeikaD.  Černiavskienė,
2025-05-14,Dėl ūkiuose susidarančių atliekų tvarkymo apmokestinimo,Kaimo reikalų komitetas,,K.  MažeikaS.  Kairienė,
2025-05-14,"​Aplinkos ir Žemės ūkio ministerijų, Lietuvos ūkininkų sąjungos, žemdirbių savivaldos organizacijų atstovai​",Kaimo reikalų komitetas,,K.  MažeikaS.  Kairienė,
2025-05-14,Kiti klausimai,Kaimo reikalų komitetas,,K.  MažeikaA.  Matulevičienė,
2025-05-07,Posėdžio darbotvarkės tvirtinimas,Kaimo reikalų komitetas,,K.  MažeikaA.  Matulevičienė,
2025-05-07,"Melioracijos įstatymo Nr. I-323 2, 7, 9 straipsnių pakeitimo ir Įstatymo papildymo VI skyriumi įstatymo projektas",Kaimo reikalų komitetas,I-323,T.  PrajaraK.  StarkevičiusG.  Rimeisienė,
2025-05-07,"Seimo narys Simonas Gentvilas (pasiūlymo teikėjas), Žemės ūkio, Aplinkos ministerijų, Lietuvos savivaldybių asociacijos, Savivaldybių žemės ūkio skyrių darbuotojų asociacijos, Lietuvos melioracijos įmonių asociacijos, Lietuvos žemėtvarkos ir hidrotechnikos inžinierių sąjungos, žemdirbių savivaldos organizacijų atstovai​",Kaimo reikalų komitetas,I-323,T.  PrajaraK.  StarkevičiusG.  Rimeisienė,
2025-05-07,"Dėl komiteto 2025-04-09 protokolinio nutarimo Nr. 110-P-10 ""Dėl kormoranų daromos žalos žuvims, auginamoms žuvininkystės ūkiuose"" vykdymo",Kaimo reikalų komitetas,110-P-10,K.  MažeikaG.  Rimeisienė,
2025-05-07,"​Aplinkos ministerijos, Žemės ūkio ministerijos, Aplinkos apsaugos agentūros, Nacionalinės akvakultūros ir žuvų produktų gamintojų asociacijos atstovai​​​",Kaimo reikalų komitetas,110-P-10,K.  MažeikaG.  Rimeisienė,
2025-05-07,Dėl veterinarinės medicinos gyvūnų augintinių sveikatos priežiūrai ir gerovei skirtų rezidentūros studijų vietų poreikio formavimo ir valstybinio finansavimo,Kaimo reikalų komitetas,,K.  MažeikaS.  Kairienė,
2025-05-07,"​Lietuvos sveikatos mokslų universiteto, Aplinkos, Švietimo, mokslo ir sporto bei Žemės ūkio ministerijų atstovai",Kaimo reikalų komitetas,,K.  MažeikaS.  Kairienė,
2025-05-07,Dėl ILTE finansavimo galimybių žemės ūkio subjektams,Kaimo reikalų komitetas,,K.  MažeikaD.  Černiavskienė,
2025-05-07,"UAB „ILTE“, Žemės ūkio ministerijos, žemdirbių savivaldos organizacijų atstovai​",Kaimo reikalų komitetas,,K.  MažeikaD.  Černiavskienė,
2025-05-07,"Dėl komiteto 2025-03-26 protokolinio nutarimo Nr. 110-P-9 ""Dėl laikino žemės ūkio paskirties žemės naudojimo užtikrinimo"" vykdymo",Kaimo reikalų komitetas,110-P-9,A.  DudėnasB.  RopėG.  Remeikienė,
2025-05-07,"​Nacionalinės žemės tarnybos prie Aplinkos ministerijos, ​Aplinkos ministerijos, Žemės ūkio ministerijos, žemdirbių savivaldos organizacijų atstovai​",Kaimo reikalų komitetas,110-P-9,A.  DudėnasB.  RopėG.  Remeikienė,
2025-05-07,Kiti klausimai,Kaimo reikalų komitetas,,K.  MažeikaA.  Matulevičienė,
2025-04-30,Posėdžio darbotvarkės tvirtinimas,Kaimo reikalų komitetas,,K.  MažeikaA.  Matulevičienė,
2025-04-30,Žuvininkystės įstatymo Nr. VIII-1756 pakeitimo įstatymo projektas (nauja redakcija),Kaimo reikalų komitetas,VIII-1756,K.  MažeikaB.  RopėG.  Rimeisienė,
2025-04-30,"​Žemės ūkio ministerijos, Teisingumo ministerijos Europos Sąjungos teisės grupės, ​Seimo kanceliarijos Teisės departamento, Specialiųjų tyrimų tarnybos, Žuvininkystės įmonių asociacijos ""Lampetra"", Žvejų ir žuvies perdirbėjų asociacijos ""Baltijos žvejas"", Žvejybos tolimuosiuose žvejybos rajonuose asociacijos ​atstovai​​​​​",Kaimo reikalų komitetas,VIII-1756,K.  MažeikaB.  RopėG.  Rimeisienė,
2025-04-30,"Administracinių nusižengimų kodekso 294, 295, 301 ir 302 straipsnių pakeitimo įstatymo projektas",Kaimo reikalų komitetas,XVP-32,K.  MažeikaG.  Rimeisienė,
2025-04-30,"​Žemės ūkio ministerijos, Teisingumo ministerijos Europos Sąjungos teisės grupės, ​Seimo kanceliarijos Teisės departamento atstovai​",Kaimo reikalų komitetas,XVP-32,K.  MažeikaG.  Rimeisienė,
2025-04-30,Specialiųjų žemės naudojimo sąlygų įstatymo Nr. XIII-2166 7 straipsnio 3 dalies 6 punkto pakeitimo įstatymo projektas,Kaimo reikalų komitetas,XIII-2166,A.  DudėnasG.  Remeikienė,
2025-04-30,"​Seimo narys Audrius Radvilavičius (iniciatorius), Aplinkos, Žemės ūkio ministerijų, žemdirbių savivaldos organizacijų atstovai",Kaimo reikalų komitetas,XIII-2166,A.  DudėnasG.  Remeikienė,
2025-04-30,Kiti klausimai,Kaimo reikalų komitetas,,K.  MažeikaA.  Matulevičienė,
2025-04-16,Posėdžio darbotvarkės tvirtinimas,Kaimo reikalų komitetas,,K.  MažeikaA.  Matulevičienė,
2025-04-16,Laukinės gyvūnijos įstatymo Nr. VIII-498 2 straipsnio pakeitimo įstatymo projektas,Kaimo reikalų komitetas,VIII-498,K.  MažeikaS.  Kairienė,
2025-04-16,"​Aplinkos, Žemės ūkio ministerijų, Valstybinės maisto ir veterinarijos tarnybos, Aplinkos apsaugos departamento prie Aplinkos ministerijos, Aplinkos apsaugos agentūros, Lietuvos sveikatos mokslų universiteto, ​žemdirbių savivaldos organizacijų atstovai ​",Kaimo reikalų komitetas,VIII-498,K.  MažeikaS.  Kairienė,
2025-04-16,Dėl Lietuvos žemės ūkio paskirties žemės politikos strategijos,Kaimo reikalų komitetas,,T.  PrajaraG.  Remeikienė,
2025-04-16,"​Žemės ūkio ministras, žemdirbių",Kaimo reikalų komitetas,,T.  PrajaraG.  Remeikienė,
2025-04-16,savivaldos organizacijų atstovai,Kaimo reikalų komitetas,,T.  PrajaraG.  Remeikienė,
2025-04-16,Dėl Valstybinės augalininkystės tarnybos prie Žemės ūkio ministerijos veiklos aktualijų,Kaimo reikalų komitetas,,K.  MažeikaS.  Kairienė,
2025-04-16,"​Valstybinės augalininkystės tarnybos prie Žemės ūkio ministerijos, žemdirbių savivaldos organizacijų atstovai​​",Kaimo reikalų komitetas,,K.  MažeikaS.  Kairienė,
2025-04-16,Kiti klausimai,Kaimo reikalų komitetas,,K.  MažeikaA.  Matulevičienė,
2025-04-09,Posėdžio darbotvarkės tvirtinimas,Kaimo reikalų komitetas,,K.  MažeikaA.  Matulevičienė,
2025-04-09,"Alkoholio kontrolės įstatymo Nr. I-857 2, 10-1, 12, 17 straipsnių pakeitimo įstatymo projektas",Kaimo reikalų komitetas,I-857,K.  MažeikaV.  PranckietisS.  Kairienė,
2025-04-09,"​Projekto iniciatorius – Kazys Starkevičius, Žemės ūkio ministerijos, Žemės ūkio agentūros prie Žemės ūkio ministerijos, Seimo Ekonomikos komiteto, Seimo Sveikatos reikalų komiteto, žemdirbių savivaldos organizacijų atstovai​",Kaimo reikalų komitetas,I-857,K.  MažeikaV.  PranckietisS.  Kairienė,
2025-04-09,"Dėl komiteto 2025-03-12 protokolinio nutarimo Nr. 110-P-7 ""Dėl kormoranų daromos žalos žuvims, auginamoms žuvininkystės ūkiuose"" vykdymo",Kaimo reikalų komitetas,110-P-7,K.  MažeikaG.  Rimeisienė,
2025-04-09,"​Aplinkos ministerijos, Žemės ūkio ministerijos, Aplinkos apsaugos agentūros, Nacionalinės akvakultūros ir žuvų produktų gamintojų asociacijos atstovai​​",Kaimo reikalų komitetas,110-P-7,K.  MažeikaG.  Rimeisienė,
2025-04-09,"KOMISIJOS KOMUNIKATAS EUROPOS PARLAMENTUI, TARYBAI, EUROPOS EKONOMIKOS IR SOCIALINIŲ REIKALŲ KOMITETUI IR REGIONŲ KOMITETUI ""Žemės ūkio ir maisto produktų gamybos vizija. Ateities kartoms patrauklaus ūkininkavimo ir žemės ūkio maisto produktų sektoriaus kūrimas bendromis jėgomis""",Kaimo reikalų komitetas,"ES-2025-15, COM/2025/75",K.  MažeikaD.  Černiavskienė,
2025-04-09,"KOMISIJOS KOMUNIKATAS EUROPOS PARLAMENTUI, TARYBAI, EUROPOS EKONOMIKOS IR SOCIALINIŲ REIKALŲ KOMITETUI IR REGIONŲ KOMITETUI ""Žemės ūkio ir maisto produktų gamybos vizija. Ateities kartoms patrauklaus ūkininkavimo ir žemės ūkio maisto produktų sektoriaus kūrimas bendromis jėgomis""",Kaimo reikalų komitetas,"ES-2025-15, COM/2025/75",K.  MažeikaD.  Černiavskienė,
2025-04-09,"Europos Komisijos atstovybės Lietuvoje, Žemės ūkio ministerijos, žemdirbių savivaldos",Kaimo reikalų komitetas,"ES-2025-15, COM/2025/75",K.  MažeikaD.  Černiavskienė,
2025-04-09,organizacijų atstovai​.,Kaimo reikalų komitetas,"ES-2025-15, COM/2025/75",K.  MažeikaD.  Černiavskienė,
2025-04-09,Dėl Nacionalinės žemės tarnybos prie Aplinkos ministerijos veiklos perspektyvų,Kaimo reikalų komitetas,,A.  DudėnasG.  Remeikienė,
2025-04-09,"Nacionalinės žemės tarnybos prie Aplinkos ministerijos, Aplinkos ministerijos​, Lietuvos savivaldybių asociacijos, žemdirbių savivaldos organizacijų​ atstovai​​​",Kaimo reikalų komitetas,,A.  DudėnasG.  Remeikienė,
2025-04-09,Kiti klausimai,Kaimo reikalų komitetas,,K.  MažeikaA.  Matulevičienė,
2025-04-02,Žuvininkystės įstatymo Nr. VIII-1756 pakeitimo įstatymo projektas (nauja redakcija),Kaimo reikalų komitetas,VIII-1756,K.  MažeikaB.  RopėG.  Rimeisienė,
2025-04-02,"​Žemės ūkio ministerijos, Teisingumo ministerijos Europos Sąjungos teisės grupės, ​Seimo kanceliarijos Teisės departamento, Specialiųjų tyrimų tarnybos, Žuvininkystės įmonių asociacijos ""Lampetra"" atstovai​​​​",Kaimo reikalų komitetas,VIII-1756,K.  MažeikaB.  RopėG.  Rimeisienė,
2025-04-02,"Administracinių nusižengimų kodekso 294, 295, 301 ir 302 straipsnių pakeitimo įstatymo projektas",Kaimo reikalų komitetas,XVP-32,K.  MažeikaG.  Rimeisienė,
2025-04-02,"mės ūkio ministerijos, Teisingumo ministerijos Europos Sąjungos teisės grupės, ​Seimo kanceliarijos Teisės departamento atstovai",Kaimo reikalų komitetas,XVP-32,K.  MažeikaG.  Rimeisienė,
2025-04-02,"mės ūkio ministerijos, Teisingumo ministerijos Europos Sąjungos teisės grupės, ​Seimo kanceliarijos Teisės departamento atstovai",Kaimo reikalų komitetas,XVP-32,K.  MažeikaG.  Rimeisienė,
2025-03-26,Posėdžio darbotvarkės tvirtinimas,Kaimo reikalų komitetas,,K.  MažeikaA.  Matulevičienė,
2025-03-26,Ribojamųjų priemonių dėl karinės agresijos prieš Ukrainą nustatymo įstatymo Nr. XIV-1888 4 ir 5 straipsnių pakeitimo įstatymo projektas,Kaimo reikalų komitetas,XIV-1888,K.  MažeikaD.  Černiavskienė,
2025-03-26,"​Žemės ūkio, Užsienio reikalų ministerijų ir",Kaimo reikalų komitetas,XIV-1888,K.  MažeikaD.  Černiavskienė,
2025-03-26,žemdirbių savivaldos organizacijų atstovai​​​​,Kaimo reikalų komitetas,XIV-1888,K.  MažeikaD.  Černiavskienė,
2025-03-26,žemdirbių savivaldos organizacijų atstovai​​​​,Kaimo reikalų komitetas,XIV-1888,K.  MažeikaD.  Černiavskienė,
2025-03-26,"Pridėtinės vertės mokesčio įstatymo Nr. IX-751 13, 28, 31, 32, 57, 58, 64, 71, 71-1, 72, 74, 75, 77, 79, 80, 81, 83, 84, 85, 88-1, 89-1, 92, 97, 98, 106, 117, 118 straipsnių ir 2 priedo pakeitimo ir Įstatymo papildymo 71-2, 74-1 ir 88-3 straipsniais įstatymo projektas",Kaimo reikalų komitetas,IX-751,K.  MažeikaD.  Černiavskienė,
2025-03-26,"​Žemės ūkio, Finansų ministerijų,",Kaimo reikalų komitetas,IX-751,K.  MažeikaD.  Černiavskienė,
2025-03-26,žemdirbių savivaldos organizacijų atstovai​​​​,Kaimo reikalų komitetas,IX-751,K.  MažeikaD.  Černiavskienė,
2025-03-26,žemdirbių savivaldos organizacijų atstovai​​​​,Kaimo reikalų komitetas,IX-751,K.  MažeikaD.  Černiavskienė,
2025-03-26,"KOMISIJOS KOMUNIKATAS EUROPOS PARLAMENTUI, TARYBAI, EUROPOS EKONOMIKOS IR SOCIALINIŲ REIKALŲ KOMITETUI IR REGIONŲ KOMITETUI. 2025 m. Komisijos darbo programa",Kaimo reikalų komitetas,"ES-2025-13, COM/2025/45",K.  MažeikaD.  Černiavskienė,
2025-03-26,"Europos Komisijos atstovybės Lietuvoje, Žemės ūkio ir Aplinkos ministerijų, žemdirbių savivaldos organizacijų atstovai​",Kaimo reikalų komitetas,"ES-2025-13, COM/2025/45",K.  MažeikaD.  Černiavskienė,
2025-03-26,Dėl Seimo prioritetų pagal Europos Komisijos 2024 m. darbo programą stebėsenos rezultatų,Kaimo reikalų komitetas,,K.  MažeikaD.  Černiavskienė,
2025-03-26,Dėl Seimo prioritetų pagal Europos Komisijos 2024 m. darbo programą stebėsenos rezultatų,Kaimo reikalų komitetas,,K.  MažeikaD.  Černiavskienė,
2025-03-26,Dėl laikino valstybinės žemės ūkio paskirties žemės naudojimo užtikrinimo,Kaimo reikalų komitetas,,A.  DudėnasB.  RopėG.  Remeikienė,
2025-03-26,"Nacionalinės žemės tarnybos prie Aplinkos ministerijos, ​Aplinkos ministerijos, Žemės ūkio ministerijos, žemdirbių savivaldos organizacijų atstovai",Kaimo reikalų komitetas,,A.  DudėnasB.  RopėG.  Remeikienė,
2025-03-26,Dėl Kaimo reikalų komiteto 2025 m. II (pavasario) sesijos darbo plano,Kaimo reikalų komitetas,,K.  MažeikaA.  Matulevičienė,
2025-03-26,Kiti klausimai,Kaimo reikalų komitetas,,K.  MažeikaA.  Matulevičienė,
2025-03-19,Posėdžio darbotvarkės tvirtinimas,Kaimo reikalų komitetas,,K.  MažeikaA.  Matulevičienė,
2025-03-19,"Žemės įstatymo Nr. I-446 2, 7, 8, 9, 10, 11, 15, 22, 23, 29, 32, 34, 35, 37, 40, 41, 43, 45, 47, 55, 56, 64, 66 straipsnių ir VI-1 skyriaus pakeitimo įstatymo projektas",Kaimo reikalų komitetas,I-446,M.  SkamarakasG.  Remeikienė,
2025-03-19,"Žemės įstatymo Nr. I-446 2, 7, 8, 9, 10, 11, 15, 22, 23, 29, 32, 34, 35, 37, 40, 41, 43, 45, 47, 55, 56, 64, 66 straipsnių ir VI-1 skyriaus pakeitimo įstatymo projektas",Kaimo reikalų komitetas,I-446,M.  SkamarakasG.  Remeikienė,
2025-03-19,"Seimo narys Linas Jonauskas (iniciatorius), Seimo narys Kęstutis ​Vilkauskas (pasiūlymo teikėjas), Aplinkos, Žemės ūkio ministerijų, Specialiųjų tyrimų tarnybos, Lietuvos verslo konfederacijos, Vilniaus miesto savivaldybės administracijos, Lietuvos savivaldybių asociacijos, Lietuvos nekilnojamojo turto plėtros asociacijos, žemdirbių savivaldos organizacijų atstovai, Giedrius Bujokas​",Kaimo reikalų komitetas,I-446,M.  SkamarakasG.  Remeikienė,
2025-03-19,"Teritorijų planavimo įstatymo Nr. I-1120 17, 18, 20, 25, 27, 28, 30, 31, 39 ir 45 straipsnių, septintojo skirsnio pavadinimo pakeitimo ir Įstatymo papildymo 42-1 straipsniu įstatymo projektas",Kaimo reikalų komitetas,I-1120,M.  SkamarakasG.  Remeikienė,
2025-03-19,"​Seimo narys Linas Jonauskas (iniciatorius), Seimo nariai Seimo nariai Robert Puchovič, Tadas Sadauskis, Remigijus Žemaitaitis (pasiūlymų teikėjai), Aplinkos, Žemės ūkio ministerijų, Lietuvos verslo konfederacijos, žemdirbių savivaldos organizacijų atstovai​",Kaimo reikalų komitetas,I-1120,M.  SkamarakasG.  Remeikienė,
2025-03-19,"Žemės reformos įstatymo Nr. I-1607 8, 9, 10, 13 ir 19 straipsnių pakeitimo įstatymo projektas",Kaimo reikalų komitetas,I-1607,M.  SkamarakasG.  Remeikienė,
2025-03-19,"Seimo narys Linas Jonauskas (iniciatorius), Aplinkos, Žemės ūkio ministerijų, žemdirbių savivaldos organizacijų atstovai",Kaimo reikalų komitetas,I-1607,M.  SkamarakasG.  Remeikienė,
2025-03-19,"Seimo narys Linas Jonauskas (iniciatorius), Aplinkos, Žemės ūkio ministerijų, žemdirbių savivaldos organizacijų atstovai",Kaimo reikalų komitetas,I-1607,M.  SkamarakasG.  Remeikienė,
2025-03-19,Žuvininkystės įstatymo Nr. VIII-1756 3 ir 23 straipsnių pakeitimo įstatymo projektas,Kaimo reikalų komitetas,VIII-1756,B.  RopėG.  Rimeisienė,
2025-03-19,"​Seimo narys Kęstutis Mažeika (iniciatorius), Aplinkos, Žemės ūkio ministerijų atstovai​​​​",Kaimo reikalų komitetas,VIII-1756,B.  RopėG.  Rimeisienė,
2025-03-19,"Dėl snukio ir nagų bei mėlynojo liežuvio ligų prevencijos ir kontrolės, pasirengimo ligų protrūkiams ir galimų pasekmių likvidavimo",Kaimo reikalų komitetas,,K.  MažeikaS.  Kairienė,
2025-03-19,"Žemės ūkio, Aplinkos ministerijų, Valstybinės maisto ir veterinarijos tarnybos, LSMU Veterinarijos akademijos, Nacionalinio maisto ir veterinarijos rizikos vertinimo instituto,  žemdirbių",Kaimo reikalų komitetas,,K.  MažeikaS.  Kairienė,
2025-03-19,savivaldos,Kaimo reikalų komitetas,,K.  MažeikaS.  Kairienė,
2025-03-19,​organizacijų atstovai​,Kaimo reikalų komitetas,,K.  MažeikaS.  Kairienė,
2025-03-19,Kiti klausimai,Kaimo reikalų komitetas,,K.  MažeikaA.  Matulevičienė,
